{
  "schema_version": 1,
  "spec": {
    "plano": "README.md",
    "regras": [
      "SKILL.md",
      "INSTALL.md",
      "references/patch-format.md"
    ]
  },
  "derivado_de_github": {
    "verificado_em": "2026-09-01T10:37:32Z",
    "main_sha": "f1419d02e991165360d77258998c177c97f01a80",
    "testes": {
      "total": 40,
      "verdes": 40,
      "comando": "node ~/.claude/skills/skill-state/bin/cli.mjs selftest"
    },
    "fases": [
      {
        "fase": "endurecer protocolo pós-#1 (spec #3, tickets #4–#10)",
        "issue": 3,
        "pr": 14,
        "status": "mergeada",
        "nota": "v1.0 kit no 3b21b1c"
      },
      {
        "fase": "instalador --global/--project e docs para leigos",
        "issue": null,
        "pr": 15,
        "status": "mergeada",
        "nota": "v1.1.0 no 4d70ba3"
      },
      {
        "fase": "CLI canônico global; install --project não copia o binário",
        "issue": null,
        "pr": 16,
        "status": "mergeada",
        "nota": "v1.1.1 HEAD deste patch ainda vai stale até o commit seguinte"
      }
    ]
  },
  "intencao": {
    "proximo_passo": "Nada pendente neste kit. Nos projetos, retomar pelo PRÓXIMO PASSO do context (APS #271, PANOPTIS #888, Quizz #8 PR, Synvera #59).",
    "pendencias": [],
    "bloqueios": [],
    "avisos_operacionais": [
      "CLI: node \"$HOME/.claude/skills/skill-state/bin/cli.mjs\" — install --global (hosts) e install --project (init, NÃO copia o binário). Não chamar <repo>/.claude/skills/skill-state/bin/cli.mjs.",
      "Grok: SessionStart pode ignorar stdout; se o PRÓXIMO PASSO não aparecer sozinho, pedir context.",
      "Codex: hooks novos exigem /hooks trust."
    ]
  },
  "meta": {
    "patch_seq": 6,
    "ultimo_hash": "645afa51aff23540ba2622a8515174b19b0964932ab936b1f543326a3580c631",
    "atualizado_em": "2026-09-01T10:37:32Z"
  }
}
