{
  "schema_version": 1,
  "spec": {
    "plano": "fixtures/PLANO-EXEMPLO.md",
    "regras": [
      "CONTRIBUTING.md"
    ]
  },
  "derivado_de_github": {
    "verificado_em": "2026-08-30T00:00:00Z",
    "main_sha": "0000000000000000000000000000000000000000",
    "testes": {
      "total": 10,
      "verdes": 10,
      "comando": "npx vitest run"
    },
    "fases": [
      {
        "fase": "S1",
        "issue": 1,
        "pr": 2,
        "status": "mergeada",
        "nota": ""
      }
    ]
  },
  "intencao": {
    "proximo_passo": "Fazer X.",
    "pendencias": [
      {
        "id": "p-1",
        "texto": "pendência um",
        "dono": "humano",
        "origem": "sessao-1"
      }
    ],
    "bloqueios": [
      {
        "id": "b-1",
        "texto": "bloqueio um"
      }
    ],
    "avisos_operacionais": [
      "npm ci após pull"
    ],
    "nota_temporaria": "apagar depois"
  },
  "meta": {
    "patch_seq": 1,
    "ultimo_hash": "1ee67e7ceedffa10f70ae909aed1d716a7d0b2d648d70920389bba6634401f9f",
    "atualizado_em": "2026-08-30T00:00:00Z"
  }
}
